[
  {
    "id": "MILLENNIUM-01",
    "collection": "millennium",
    "number": 1,
    "title": "Birch and Swinnerton-Dyer",
    "scope": "Arithmetic of elliptic curves and special L-values.",
    "status": "open",
    "status_basis": "Clay retains the unsolved classification.",
    "problem_ids": [
      "Q-LAND-302"
    ],
    "source_ids": [
      "SRC-LAND-301",
      "SRC-LAND-303"
    ],
    "source_locator": "Clay collection status list; linked official description where applicable.",
    "last_checked": "2026-10-14"
  },
  {
    "id": "MILLENNIUM-02",
    "collection": "millennium",
    "number": 2,
    "title": "Hodge",
    "scope": "Algebraic cycles representing rational Hodge classes.",
    "status": "open",
    "status_basis": "Clay retains the unsolved classification.",
    "problem_ids": [
      "Q-LAND-303"
    ],
    "source_ids": [
      "SRC-LAND-301",
      "SRC-LAND-304"
    ],
    "source_locator": "Clay collection status list; linked official description where applicable.",
    "last_checked": "2026-10-14"
  },
  {
    "id": "MILLENNIUM-03",
    "collection": "millennium",
    "number": 3,
    "title": "Navier-Stokes",
    "scope": "Existence and regularity alternatives for three-dimensional incompressible flow.",
    "status": "claimed_resolution_under_review",
    "status_basis": "Clay reports an apparent settlement under evaluation; final acceptance is not recorded.",
    "problem_ids": [
      "Q-LAND-305"
    ],
    "source_ids": [
      "SRC-LAND-301",
      "SRC-LAND-306",
      "SRC-MATH-015"
    ],
    "source_locator": "Clay collection status list; linked official description where applicable.",
    "last_checked": "2026-10-14"
  },
  {
    "id": "MILLENNIUM-04",
    "collection": "millennium",
    "number": 4,
    "title": "P versus NP",
    "scope": "Deterministic versus nondeterministic polynomial time.",
    "status": "open",
    "status_basis": "Clay retains the unsolved classification.",
    "problem_ids": [
      "Q-LAND-304"
    ],
    "source_ids": [
      "SRC-LAND-301",
      "SRC-LAND-305"
    ],
    "source_locator": "Clay collection status list; linked official description where applicable.",
    "last_checked": "2026-10-14"
  },
  {
    "id": "MILLENNIUM-05",
    "collection": "millennium",
    "number": 5,
    "title": "Poincare",
    "scope": "Closed simply connected topological three-manifolds and the three-sphere.",
    "status": "resolved",
    "status_basis": "Clay places this problem in its solved category; it is historical context, not a new open candidate.",
    "problem_ids": [],
    "source_ids": [
      "SRC-LAND-301"
    ],
    "source_locator": "Clay collection status list; linked official description where applicable.",
    "last_checked": "2026-10-14"
  },
  {
    "id": "MILLENNIUM-06",
    "collection": "millennium",
    "number": 6,
    "title": "Riemann hypothesis",
    "scope": "Nontrivial zeros of the Riemann zeta function.",
    "status": "open",
    "status_basis": "Clay retains the unsolved classification.",
    "problem_ids": [
      "Q-LAND-301"
    ],
    "source_ids": [
      "SRC-LAND-301",
      "SRC-LAND-302"
    ],
    "source_locator": "Clay collection status list; linked official description where applicable.",
    "last_checked": "2026-10-14"
  },
  {
    "id": "MILLENNIUM-07",
    "collection": "millennium",
    "number": 7,
    "title": "Yang-Mills existence and mass gap",
    "scope": "Rigorous four-dimensional quantum Yang-Mills theory with positive mass gap.",
    "status": "open",
    "status_basis": "Clay retains the unsolved classification.",
    "problem_ids": [
      "Q-MODEL-004"
    ],
    "source_ids": [
      "SRC-LAND-301"
    ],
    "source_locator": "Clay collection status list; linked official description where applicable.",
    "last_checked": "2026-10-14"
  },
  {
    "id": "HILBERT-01",
    "collection": "hilbert",
    "number": 1,
    "title": "Continuum hypothesis",
    "scope": "Does 2^aleph_0=aleph_1? Hilbert also asked whether the real numbers can be well ordered; that component follows from the axiom of choice in ZFC.",
    "status": "independence",
    "status_basis": "The continuum hypothesis is independent of ZFC, assuming its consistency. The well-ordering component is a theorem of ZFC; the two claims must not share an undifferentiated open label.",
    "problem_ids": [],
    "source_ids": [
      "SRC-LAND-307",
      "SRC-LAND-308"
    ],
    "source_locator": "Hilbert, Problem 1; recent overview, matching numbered paragraph. Additional scope qualifications use the linked specialist source.",
    "last_checked": "2026-10-14"
  },
  {
    "id": "HILBERT-02",
    "collection": "hilbert",
    "number": 2,
    "title": "Consistency of arithmetic",
    "scope": "Foundations and allowed methods for consistency proofs.",
    "status": "formulation_dependent",
    "status_basis": "Formal-system restrictions are decisive after Godel.",
    "problem_ids": [],
    "source_ids": [
      "SRC-LAND-307",
      "SRC-LAND-308"
    ],
    "source_locator": "Hilbert, Problem 2; recent overview, matching numbered paragraph. Additional scope qualifications use the linked specialist source.",
    "last_checked": "2026-10-14"
  },
  {
    "id": "HILBERT-03",
    "collection": "hilbert",
    "number": 3,
    "title": "Scissors congruence of tetrahedra",
    "scope": "Equal volume versus finite dissection and reassembly.",
    "status": "resolved",
    "status_basis": "Dehn supplied a negative answer.",
    "problem_ids": [],
    "source_ids": [
      "SRC-LAND-307",
      "SRC-LAND-308"
    ],
    "source_locator": "Hilbert, Problem 3; recent overview, matching numbered paragraph. Additional scope qualifications use the linked specialist source.",
    "last_checked": "2026-10-14"
  },
  {
    "id": "HILBERT-04",
    "collection": "hilbert",
    "number": 4,
    "title": "Straight lines as shortest paths",
    "scope": "Geometries and metrics with straight-line geodesics.",
    "status": "formulation_dependent",
    "status_basis": "The intended class of metrics matters.",
    "problem_ids": [],
    "source_ids": [
      "SRC-LAND-307",
      "SRC-LAND-308"
    ],
    "source_locator": "Hilbert, Problem 4; recent overview, matching numbered paragraph. Additional scope qualifications use the linked specialist source.",
    "last_checked": "2026-10-14"
  },
  {
    "id": "HILBERT-05",
    "collection": "hilbert",
    "number": 5,
    "title": "Continuous transformation groups",
    "scope": "Relations between topological groups and Lie groups.",
    "status": "formulation_dependent",
    "status_basis": "The standard locally Euclidean group case is resolved.",
    "problem_ids": [],
    "source_ids": [
      "SRC-LAND-307",
      "SRC-LAND-308"
    ],
    "source_locator": "Hilbert, Problem 5; recent overview, matching numbered paragraph. Additional scope qualifications use the linked specialist source.",
    "last_checked": "2026-10-14"
  },
  {
    "id": "HILBERT-06",
    "collection": "hilbert",
    "number": 6,
    "title": "Axiomatization of physics",
    "scope": "Axioms and limiting relations for physical theories.",
    "status": "broad_program",
    "status_basis": "No single theorem exhausts this program.",
    "problem_ids": [],
    "source_ids": [
      "SRC-LAND-307",
      "SRC-LAND-308"
    ],
    "source_locator": "Hilbert, Problem 6; recent overview, matching numbered paragraph. Additional scope qualifications use the linked specialist source.",
    "last_checked": "2026-10-14"
  },
  {
    "id": "HILBERT-07",
    "collection": "hilbert",
    "number": 7,
    "title": "Transcendence of algebraic powers",
    "scope": "Algebraic bases other than zero and one raised to algebraic irrational powers.",
    "status": "resolved",
    "status_basis": "Gelfond-Schneider resolves the classical statement.",
    "problem_ids": [],
    "source_ids": [
      "SRC-LAND-307",
      "SRC-LAND-308"
    ],
    "source_locator": "Hilbert, Problem 7; recent overview, matching numbered paragraph. Additional scope qualifications use the linked specialist source.",
    "last_checked": "2026-10-14"
  },
  {
    "id": "HILBERT-08",
    "collection": "hilbert",
    "number": 8,
    "title": "Prime numbers and zeta zeros",
    "scope": "Riemann hypothesis, additive prime representations and prime gaps.",
    "status": "partly_open",
    "status_basis": "Several explicitly stated prime problems remain open.",
    "problem_ids": [
      "Q-LAND-301",
      "Q-LAND-306",
      "Q-LAND-307"
    ],
    "source_ids": [
      "SRC-LAND-307",
      "SRC-LAND-308"
    ],
    "source_locator": "Hilbert, Problem 8; recent overview, matching numbered paragraph. Additional scope qualifications use the linked specialist source.",
    "last_checked": "2026-10-14"
  },
  {
    "id": "HILBERT-09",
    "collection": "hilbert",
    "number": 9,
    "title": "General reciprocity laws",
    "scope": "Reciprocity across algebraic number fields.",
    "status": "formulation_dependent",
    "status_basis": "Class-field results leave broader interpretations.",
    "problem_ids": [],
    "source_ids": [
      "SRC-LAND-307",
      "SRC-LAND-308"
    ],
    "source_locator": "Hilbert, Problem 9; recent overview, matching numbered paragraph. Additional scope qualifications use the linked specialist source.",
    "last_checked": "2026-10-14"
  },
  {
    "id": "HILBERT-10",
    "collection": "hilbert",
    "number": 10,
    "title": "Diophantine decidability over the integers",
    "scope": "A general algorithm for integer solutions of polynomial equations.",
    "status": "resolved",
    "status_basis": "Undecidability answers the original integer question.",
    "problem_ids": [],
    "source_ids": [
      "SRC-LAND-307",
      "SRC-LAND-308"
    ],
    "source_locator": "Hilbert, Problem 10; recent overview, matching numbered paragraph. Additional scope qualifications use the linked specialist source.",
    "last_checked": "2026-10-14"
  },
  {